budget,genres,id,original_language,overview,popularity,production_companies,production_countries,release_date,revenue,runtime,spoken_languages,status,tagline,title,vote_average,vote_count,release_year,return,id_collection,name_collection,genres_cleaned,producer_cleaned,Country_cleaned,Language_cleaned
5000000,"[{'id': 27, 'name': 'Horror'}, {'id': 53, 'name': 'Thriller'}]",10072,en,"It's been many years since Freddy Krueger's first victim, Nancy, came face-to-face with Freddy and his sadistic, evil ways. Now, Nancy's all grown up; she's put her frightening nightmares behind her and is helping teens cope with their dreams. Too bad Freddy's decided to herald his return by invading the kids' dreams and scaring them into committing suicide.",10.035081,"[{'name': 'New Line Cinema', 'id': 12}, {'name': 'Smart Egg Pictures', 'id': 1531}]","[{'iso_3166_1': 'US', 'name': 'United States of America'}]",1987-02-27,44793222.0,96.0,"[{'iso_639_1': 'en', 'name': 'English'}]",Released,"If you think you're ready for Freddy, think again!",A Nightmare on Elm Street 3: Dream Warriors,6.5,363.0,1987,8.9586444,8581.0,A Nightmare on Elm Street Collection,"Horror, Thriller",New Line Cinema,United States of America,English
50000000,"[{'id': 14, 'name': 'Fantasy'}, {'id': 28, 'name': 'Action'}, {'id': 878, 'name': 'Science Fiction'}, {'id': 53, 'name': 'Thriller'}]",834,en,"As the war between the vampires and the Lycans rages on, Selene, a former member of the Death Dealers (an elite vampire special forces unit that hunts werewolves), and Michael, the werewolf hybrid, work together in an effort to unlock the secrets of their respective bloodlines.",12.496805,"[{'name': 'Lakeshore Entertainment', 'id': 126}, {'name': 'Screen Gems', 'id': 3287}]","[{'iso_3166_1': 'US', 'name': 'United States of America'}]",2006-01-12,111340801.0,106.0,"[{'iso_639_1': 'en', 'name': 'English'}, {'iso_639_1': 'fr', 'name': 'Français'}, {'iso_639_1': 'hu', 'name': 'Magyar'}]",Released,"My God. Brother, what have you done?",Underworld: Evolution,6.4,1548.0,2006,2.22681602,2326.0,Underworld Collection,"Fantasy, Action, Science Fiction, Thriller",Lakeshore Entertainment,United States of America,English
37000000,"[{'id': 12, 'name': 'Adventure'}, {'id': 35, 'name': 'Comedy'}, {'id': 10751, 'name': 'Family'}, {'id': 14, 'name': 'Fantasy'}]",10488,en,A young girl inhabits an isolated island with her scientist father and communicates with a reclusive author of the novel she's reading.,7.558125,"[{'name': 'Walden Media', 'id': 10221}]","[{'iso_3166_1': 'US', 'name': 'United States of America'}]",2008-04-03,100076342.0,96.0,"[{'iso_639_1': 'en', 'name': 'English'}]",Released,Your adventure starts here.,Nim's Island,5.6,341.0,2008,2.704766,232844.0,Nim's Island Collection,"Adventure, Comedy, Family, Fantasy",Walden Media,United States of America,English
15000000,"[{'id': 28, 'name': 'Action'}]",97430,en,"In feudal China, a blacksmith who makes weapons for a small village is put in the position where he must defend himself and his fellow villagers.",8.310945,"[{'name': 'Arcade Pictures', 'id': 11112}, {'name': 'Iron Fists', 'id': 11113}]","[{'iso_3166_1': 'HK', 'name': 'Hong Kong'}, {'iso_3166_1': 'US', 'name': 'United States of America'}]",2012-11-02,15608545.0,96.0,"[{'iso_639_1': 'en', 'name': 'English'}]",Released,You can't spell Kung Fu without F and U!,The Man with the Iron Fists,5.2,369.0,2012,1.0405696666666666,334356.0,The Man with the Iron Fists Collection,Action,Arcade Pictures,Hong Kong,English
10000000,"[{'id': 12, 'name': 'Adventure'}, {'id': 35, 'name': 'Comedy'}, {'id': 878, 'name': 'Science Fiction'}]",1648,en,"In the small town of San Dimas, a few miles away from Los Angeles, there are two nearly brain dead teenage boys going by the names of Bill S, Preston ESQ. and Ted Theodore Logan, they have a dream together of starting their own rock and roll band called the ""Wyld Stallyns"". Unfortunately, they are still in high school and on the verge of failing out of their school as well, and if they do not pass their upcoming history report, they will be separated as a result of Ted's father sending him to military school. But, what Bill and Ted do not know is that they must stay together to save the future. So, a man from the future named Rufus came to help them pass their report. So, both Bill and Ted decided to gather up historical figures which they need for their report. They are hoping that this will help them pass their report so they can stay together.",15.109261,"[{'name': 'Orion Pictures', 'id': 41}]","[{'iso_3166_1': 'US', 'name': 'United States of America'}]",1989-02-17,40485039.0,90.0,"[{'iso_639_1': 'en', 'name': 'English'}, {'iso_639_1': 'fr', 'name': 'Français'}, {'iso_639_1': 'de', 'name': 'Deutsch'}, {'iso_639_1': 'el', 'name': 'ελληνικά'}]",Released,History is about to be rewritten by two guys who can't spell.,Bill & Ted's Excellent Adventure,6.7,464.0,1989,4.0485039,91746.0,Bill & Ted's Most Excellent Collection,"Adventure, Comedy, Science Fiction",Orion Pictures,United States of America,English
200000000,"[{'id': 10751, 'name': 'Family'}, {'id': 14, 'name': 'Fantasy'}, {'id': 12, 'name': 'Adventure'}]",12155,en,"Alice, an unpretentious and individual 19-year-old, is betrothed to a dunce of an English nobleman. At her engagement party, she escapes the crowd to consider whether to go through with the marriage and falls down a hole in the garden after spotting an unusual rabbit. Arriving in a strange and surreal place called 'Underland,' she finds herself in a world that resembles the nightmares she had as a child, filled with talking animals, villainous queens and knights, and frumious bandersnatches. Alice realizes that she is there for a reason – to conquer the horrific Jabberwocky and restore the rightful queen to her throne.",17.285093,"[{'name': 'Walt Disney Pictures', 'id': 2}, {'name': 'Team Todd', 'id': 598}, {'name': 'Tim Burton Productions', 'id': 8601}, {'name': 'Roth Films', 'id': 16314}, {'name': 'Zanuck Company, The', 'id': 20004}]","[{'iso_3166_1': 'US', 'name': 'United States of America'}]",2010-03-03,1025491110.0,108.0,"[{'iso_639_1': 'en', 'name': 'English'}]",Released,You're invited to a very important date.,Alice in Wonderland,6.4,4773.0,2010,5.12745555,261307.0,Alice in Wonderland Collection,"Family, Fantasy, Adventure",Walt Disney Pictures,United States of America,English
40000000,"[{'id': 12, 'name': 'Adventure'}, {'id': 35, 'name': 'Comedy'}, {'id': 10751, 'name': 'Family'}, {'id': 878, 'name': 'Science Fiction'}]",165,en,"Marty and Doc are at it again in this wacky sequel to the 1985 blockbuster as the time-traveling duo head to 2015 to nip some McFly family woes in the bud. But things go awry thanks to bully Biff Tannen and a pesky sports almanac. In a last-ditch attempt to set things straight, Marty finds himself bound for 1955 and face to face with his teenage parents -- again.",13.689855,"[{'name': 'Universal Pictures', 'id': 33}, {'name': 'Amblin Entertainment', 'id': 56}, {'name': 'U-Drive Productions', 'id': 20448}]","[{'iso_3166_1': 'US', 'name': 'United States of America'}]",1989-11-20,332000000.0,108.0,"[{'iso_639_1': 'en', 'name': 'English'}]",Released,"Roads? Where we're going, we don't need roads!",Back to the Future Part II,7.4,3926.0,1989,8.3,264.0,Back to the Future Collection,"Adventure, Comedy, Family, Science Fiction",Universal Pictures,United States of America,English
35000000,"[{'id': 28, 'name': 'Action'}, {'id': 12, 'name': 'Adventure'}, {'id': 80, 'name': 'Crime'}, {'id': 878, 'name': 'Science Fiction'}, {'id': 53, 'name': 'Thriller'}]",5549,en,"After a successful deployment of the Robocop Law Enforcement unit, OCP sees its goal of urban pacification come closer and closer, but as this develops, a new narcotic known as ""Nuke"" invades the streets led by God-delirious leader Cane. As this menace grows, it may prove to be too much for Murphy to handle. OCP tries to replicate the success of the first unit, but ends up with failed prototypes with suicidal issues... until Dr. Faxx, a scientist straying away from OCP's path, uses Cane as the new subject for the Robocop 2 project, a living God.",10.969876,"[{'name': 'Orion Pictures', 'id': 41}]","[{'iso_3166_1': 'US', 'name': 'United States of America'}]",1990-06-22,45681173.0,117.0,"[{'iso_639_1': 'en', 'name': 'English'}]",Released,He's back to protect the innocent.,RoboCop 2,5.6,498.0,1990,1.3051763714285713,5547.0,RoboCop Collection,"Action, Adventure, Crime, Science Fiction, Thriller",Orion Pictures,United States of America,English
14000000,"[{'id': 27, 'name': 'Horror'}, {'id': 53, 'name': 'Thriller'}, {'id': 14, 'name': 'Fantasy'}]",11586,en,"Bizarre nightmares plague Regan MacNeil four years after her possession and exorcism. Has the demon returned? And if so, can the combined faith and knowledge of a Vatican investigator and a hypnotic research specialist free her from its grasp?",8.266984,"[{'name': 'Warner Bros.', 'id': 6194}]","[{'iso_3166_1': 'US', 'name': 'United States of America'}]",1977-06-17,30749142.0,118.0,"[{'iso_639_1': 'en', 'name': 'English'}, {'iso_639_1': 'fr', 'name': 'Français'}, {'iso_639_1': 'es', 'name': 'Español'}]",Released,It's four years later... what does she remember?,Exorcist II: The Heretic,4.5,137.0,1977,2.1963672857142855,12263.0,The Exorcist Collection,"Horror, Thriller, Fantasy",Warner Bros.,United States of America,English
45000000,"[{'id': 27, 'name': 'Horror'}, {'id': 28, 'name': 'Action'}]",36647,en,"When Blade's mother was bitten by a vampire during pregnancy, she did not know that she gave her son a special gift while dying: All the good vampire attributes in combination with the best human skills. Blade and his mentor Whistler battle an evil vampire rebel (Deacon Frost) who plans to take over the outdated vampire council, capture Blade and resurrect voracious blood god La Magra.",15.043454,"[{'name': 'New Line Cinema', 'id': 12}, {'name': 'Amen Ra Films', 'id': 421}, {'name': 'Imaginary Forces', 'id': 11321}, {'name': 'Marvel Enterprises', 'id': 19551}]","[{'iso_3166_1': 'US', 'name': 'United States of America'}]",1998-08-21,131183530.0,120.0,"[{'iso_639_1': 'ru', 'name': 'Pусский'}, {'iso_639_1': 'en', 'name': 'English'}]",Released,Part Man. Part Vampire. All Hero.,Blade,6.5,1950.0,1998,2.9151895555555556,735.0,Blade Collection,"Horror, Action",New Line Cinema,United States of America,Pусский
30000000,"[{'id': 18, 'name': 'Drama'}, {'id': 10749, 'name': 'Romance'}]",41233,en,"A tight-knit group of New York City street dancers, including Luke and Natalie, team up with NYU freshman Moose, and find themselves pitted against the world's best hip hop dancers in a high-stakes showdown that will change their lives forever.",9.111782,"[{'name': 'Summit Entertainment', 'id': 491}, {'name': 'Touchstone Pictures', 'id': 9195}]","[{'iso_3166_1': 'US', 'name': 'United States of America'}]",2010-08-04,159291809.0,107.0,"[{'iso_639_1': 'en', 'name': 'English'}]",Released,Two Worlds. One Dream.,Step Up 3D,6.6,595.0,2010,5.309726966666667,86092.0,Step Up Collection,"Drama, Romance",Summit Entertainment,United States of America,English
1000000,"[{'id': 10770, 'name': 'TV Movie'}, {'id': 27, 'name': 'Horror'}]",205321,en,"A freak hurricane hits Los Angeles, causing man-eating sharks to be scooped up in tornadoes and flooding the city with shark-infested seawater. Surfer and bar-owner Fin sets out with his friends Baz and Nova to rescue his estranged wife April and teenage daughter Claudia",4.928195,"[{'name': 'The Asylum', 'id': 1311}, {'name': 'Syfy', 'id': 6677}, {'name': 'Southward Films', 'id': 22872}]","[{'iso_3166_1': 'US', 'name': 'United States of America'}]",2013-07-11,0.0,86.0,"[{'iso_639_1': 'en', 'name': 'English'}]",Released,Enough said!,Sharknado,3.8,484.0,2013,0.0,286023.0,Sharknado Collection,"TV Movie, Horror",The Asylum,United States of America,English
25000000,"[{'id': 53, 'name': 'Thriller'}, {'id': 28, 'name': 'Action'}, {'id': 80, 'name': 'Crime'}]",287948,en,"The fast-paced action movie is again set in the criminal underworld in France, where Frank Martin is known as The Transporter, because he is the best driver and mercenary money can buy. In this installment, he meets Anna and they attempt to take down a group of ruthless Russian human traffickers who also have kidnapped Frank’s father.",11.007319,"[{'name': 'EuropaCorp', 'id': 6896}]","[{'iso_3166_1': 'BE', 'name': 'Belgium'}, {'iso_3166_1': 'CN', 'name': 'China'}, {'iso_3166_1': 'FR', 'name': 'France'}]",2015-09-03,72629670.0,96.0,"[{'iso_639_1': 'en', 'name': 'English'}]",Released,He Delivers.,The Transporter Refueled,5.3,573.0,2015,2.9051868,9518.0,The Transporter Collection,"Thriller, Action, Crime",EuropaCorp,Belgium,English
19000000,"[{'id': 35, 'name': 'Comedy'}]",55465,en,"Six years have elapsed since Guantanamo Bay, leaving Harold and Kumar estranged from one another with very different families, friends and lives. But when Kumar arrives on Harold's doorstep during the holiday season with a mysterious package in hand, he inadvertently burns down Harold's father-in-law's beloved Christmas tree. To fix the problem, Harold and Kumar embark on a mission through New York City to find the perfect Christmas tree, once again stumbling into trouble at every single turn.",10.724679,"[{'name': 'New Line Cinema', 'id': 12}, {'name': 'Mandate Pictures', 'id': 771}]","[{'iso_3166_1': 'US', 'name': 'United States of America'}]",2011-11-04,35387212.0,108.0,"[{'iso_639_1': 'en', 'name': 'English'}]",Released,Christmas comes prematurely.,A Very Harold & Kumar Christmas,6.0,335.0,2011,1.862484842105263,30663.0,Harold & Kumar Collection,Comedy,New Line Cinema,United States of America,English
35000000,"[{'id': 35, 'name': 'Comedy'}, {'id': 80, 'name': 'Crime'}]",51540,en,"For Nick, Kurt and Dale, the only thing that would make the daily grind more tolerable would be to grind their intolerable bosses into dust. Quitting is not an option, so, with the benefit of a few-too-many drinks and some dubious advice from a hustling ex-con, the three friends devise a convoluted and seemingly foolproof plan to rid themselves of their respective employers... permanently.",9.856955,"[{'name': 'New Line Cinema', 'id': 12}, {'name': 'Rat Entertainment', 'id': 12007}]","[{'iso_3166_1': 'US', 'name': 'United States of America'}]",2011-07-08,117000000.0,98.0,"[{'iso_639_1': 'en', 'name': 'English'}]",Released,Ever wish your boss was dead?,Horrible Bosses,6.4,2341.0,2011,3.342857142857143,280588.0,Horrible Bosses Collection,"Comedy, Crime",New Line Cinema,United States of America,English
5000000,"[{'id': 27, 'name': 'Horror'}, {'id': 9648, 'name': 'Mystery'}, {'id': 53, 'name': 'Thriller'}]",10576,en,"Years of treatment at a mental institution for the criminally insane, Norman Bates still can't quite elude the demands of ""Mother."" Vera Miles also returns as the inquisitive woman who is haunted by her sister's brutal murder and the ominous motel where it all occurred.",6.370495,"[{'name': 'Universal Pictures', 'id': 33}, {'name': 'Oak', 'id': 16838}]","[{'iso_3166_1': 'US', 'name': 'United States of America'}]",1983-06-03,34725000.0,113.0,"[{'iso_639_1': 'en', 'name': 'English'}]",Released,"It's 22 years later, and Norman Bates is finally coming home.",Psycho II,6.0,128.0,1983,6.945,119674.0,Psycho Collection,"Horror, Mystery, Thriller",Universal Pictures,United States of America,English
5000000,"[{'id': 18, 'name': 'Drama'}, {'id': 27, 'name': 'Horror'}]",9871,en,"The story of two outcast sisters, Ginger (Katharine Isabelle) and Brigitte (Emily Perkins), in the mindless suburban town of Bailey Downs. On the night of Ginger's first period, she is savagely attacked by a wild creature. Ginger's wounds miraculously heal but something is not quite right. Now Brigitte must save her sister and save herself.",5.603312,"[{'name': 'Copperheart Entertainment', 'id': 5106}]","[{'iso_3166_1': 'CA', 'name': 'Canada'}, {'iso_3166_1': 'US', 'name': 'United States of America'}]",2000-08-01,0.0,108.0,"[{'iso_639_1': 'en', 'name': 'English'}]",Released,Hungry like the Wolf.,Ginger Snaps,6.6,211.0,2000,0.0,11794.0,Ginger Snaps Collection,"Drama, Horror",Copperheart Entertainment,Canada,English
15000000,"[{'id': 80, 'name': 'Crime'}, {'id': 27, 'name': 'Horror'}, {'id': 53, 'name': 'Thriller'}]",11454,en,"FBI Agent Will Graham, who retired after catching Hannibal Lecktor, returns to duty to engage in a risky cat-and-mouse game with Lecktor to capture a new killer.",0.338943,"[{'name': 'De Laurentiis Entertainment Group (DEG)', 'id': 484}, {'name': 'Red Dragon Productions S.A.', 'id': 67627}]","[{'iso_3166_1': 'US', 'name': 'United States of America'}]",1986-08-14,8620929.0,119.0,"[{'iso_639_1': 'en', 'name': 'English'}]",Released,Enter the mind of a serial killer… you may never come back,Manhunter,6.8,340.0,1986,0.5747286,9743.0,The Hannibal Lecter Anthology,"Crime, Horror, Thriller",De Laurentiis Entertainment Group (DEG),United States of America,English
150000000,"[{'id': 12, 'name': 'Adventure'}, {'id': 16, 'name': 'Animation'}, {'id': 18, 'name': 'Drama'}, {'id': 10751, 'name': 'Family'}]",37135,en,"Tarzan was a small orphan who was raised by an ape named Kala since he was a child. He believed that this was his family, but on an expedition Jane Porter is rescued by Tarzan. He then finds out that he's human. Now Tarzan must make the decision as to which family he should belong to...",12.453452,"[{'name': 'Walt Disney Pictures', 'id': 2}]","[{'iso_3166_1': 'US', 'name': 'United States of America'}]",1999-06-18,448000000.0,88.0,"[{'iso_639_1': 'en', 'name': 'English'}]",Released,An immortal legend. As you've only imagined.,Tarzan,7.1,1715.0,1999,2.986666666666667,106768.0,Tarzan (Animation) Collection,"Adventure, Animation, Drama, Family",Walt Disney Pictures,United States of America,English
63000000,"[{'id': 35, 'name': 'Comedy'}, {'id': 80, 'name': 'Crime'}, {'id': 878, 'name': 'Science Fiction'}]",818,en,"The world's most shagadelic spy continues his fight against Dr. Evil. This time, the diabolical doctor and his clone, Mini-Me, team up with a new foe -- '70s kingpin Goldmember. While pursuing the team of villains to stop them from world domination, Austin gets help from his dad and an old girlfriend.",8.786653,"[{'name': 'New Line Cinema', 'id': 12}, {'name': ""Eric's Boy"", 'id': 595}, {'name': 'Team Todd', 'id': 598}, {'name': 'Moving Pictures', 'id': 15888}, {'name': 'Gratitude International', 'id': 52943}]","[{'iso_3166_1': 'US', 'name': 'United States of America'}]",2002-07-26,296655431.0,94.0,"[{'iso_639_1': 'en', 'name': 'English'}, {'iso_639_1': 'ja', 'name': '日本語'}, {'iso_639_1': 'de', 'name': 'Deutsch'}, {'iso_639_1': 'fr', 'name': 'Français'}]",Released,He's still evil... He's still deadly... and he's still surrounded by frickin' idiots!,Austin Powers in Goldmember,5.9,997.0,2002,4.7088163650793655,1006.0,Austin Powers Collection,"Comedy, Crime, Science Fiction",New Line Cinema,United States of America,English
94000000,"[{'id': 12, 'name': 'Adventure'}, {'id': 14, 'name': 'Fantasy'}, {'id': 28, 'name': 'Action'}]",122,en,"Aragorn is revealed as the heir to the ancient kings as he, Gandalf and the other members of the broken fellowship struggle to save Gondor from Sauron's forces. Meanwhile, Frodo and Sam bring the ring closer to the heart of Mordor, the dark lord's realm.",29.324358,"[{'name': 'WingNut Films', 'id': 11}, {'name': 'New Line Cinema', 'id': 12}]","[{'iso_3166_1': 'NZ', 'name': 'New Zealand'}, {'iso_3166_1': 'US', 'name': 'United States of America'}]",2003-12-01,1118888979.0,201.0,"[{'iso_639_1': 'en', 'name': 'English'}]",Released,The eye of the enemy is moving.,The Lord of the Rings: The Return of the King,8.1,8226.0,2003,11.903074244680852,119.0,The Lord of the Rings Collection,"Adventure, Fantasy, Action",WingNut Films,New Zealand,English
54000000,"[{'id': 35, 'name': 'Comedy'}, {'id': 10751, 'name': 'Family'}]",11674,en,"The Live action adaptation of a Disney Classic. When a litter of dalmatian puppies are abducted by the minions of Cruella De Vil, the parents must find them before she uses them for a diabolical fashion statement.",11.470748,"[{'name': 'Walt Disney Pictures', 'id': 2}, {'name': 'Great Oaks Entertainment', 'id': 2173}]","[{'iso_3166_1': 'GB', 'name': 'United Kingdom'}, {'iso_3166_1': 'US', 'name': 'United States of America'}]",1996-11-17,320689294.0,103.0,"[{'iso_639_1': 'en', 'name': 'English'}]",Released,So many dogs. So little time.,101 Dalmatians,5.6,722.0,1996,5.93869062962963,124916.0,101 Dalmatians (Live-Action) Collection,"Comedy, Family",Walt Disney Pictures,United Kingdom,English
84000000,"[{'id': 14, 'name': 'Fantasy'}, {'id': 35, 'name': 'Comedy'}, {'id': 10751, 'name': 'Family'}, {'id': 12, 'name': 'Adventure'}]",10214,en,"Tim Avery, an aspiring cartoonist, finds himself in a predicament when his dog stumbles upon the mask of Loki. Then after conceiving an infant son ""born of the mask"", he discovers just how looney child raising can be.",6.512277,"[{'name': 'New Line Cinema', 'id': 12}, {'name': 'Pathé Distribution', 'id': 3012}]","[{'iso_3166_1': 'DE', 'name': 'Germany'}, {'iso_3166_1': 'US', 'name': 'United States of America'}]",2005-02-18,0.0,94.0,"[{'iso_639_1': 'en', 'name': 'English'}]",Released,Who's next?,Son of the Mask,3.6,346.0,2005,0.0,43072.0,The Mask Collection,"Fantasy, Comedy, Family, Adventure",New Line Cinema,Germany,English
400000,"[{'id': 12, 'name': 'Adventure'}, {'id': 28, 'name': 'Action'}, {'id': 53, 'name': 'Thriller'}, {'id': 878, 'name': 'Science Fiction'}]",9659,en,"In a dystopian future Australia, a vicious biker gang murders a cop's family, and makes his fight with them personal.",11.412619,"[{'name': 'Kennedy Miller Productions', 'id': 2537}, {'name': 'Mad Max Films', 'id': 8831}, {'name': 'Crossroads', 'id': 11962}]","[{'iso_3166_1': 'AU', 'name': 'Australia'}]",1979-04-12,100000000.0,93.0,"[{'iso_639_1': 'en', 'name': 'English'}]",Released,The Maximum Force Of The Future,Mad Max,6.6,1235.0,1979,250.0,8945.0,Mad Max Collection,"Adventure, Action, Thriller, Science Fiction",Kennedy Miller Productions,Australia,English
20000000,"[{'id': 28, 'name': 'Action'}, {'id': 53, 'name': 'Thriller'}]",245891,en,Ex-lunatic John Wick comes off his meds to track down the bounders that killed his dog and made off with his self-respect,183.870374,"[{'name': 'Summit Entertainment', 'id': 491}, {'name': 'Warner Bros.', 'id': 6194}, {'name': '87Eleven', 'id': 23008}, {'name': 'DefyNite Films', 'id': 36259}, {'name': 'MJW Films', 'id': 36433}]","[{'iso_3166_1': 'CA', 'name': 'Canada'}, {'iso_3166_1': 'CN', 'name': 'China'}, {'iso_3166_1': 'US', 'name': 'United States of America'}]",2014-10-22,88761661.0,101.0,"[{'iso_639_1': 'hu', 'name': 'Magyar'}, {'iso_639_1': 'en', 'name': 'English'}, {'iso_639_1': 'ru', 'name': 'Pусский'}]",Released,Don't set him off.,John Wick,7.0,5499.0,2014,4.43808305,404609.0,John Wick Collection,"Action, Thriller",Summit Entertainment,Canada,Magyar
80000000,"[{'id': 35, 'name': 'Comedy'}, {'id': 80, 'name': 'Crime'}]",9535,en,"Countless wiseguy films are spoofed in this film that centers on the neuroses and angst of a powerful Mafia racketeer who suffers from panic attacks. When Paul Vitti needs help dealing with his role in the ""family,"" unlucky shrink Dr. Ben Sobel is given just days to resolve Vitti's emotional crisis and turn him into a happy, well-adjusted gangster.",7.634017,"[{'name': 'Spring Creek Productions', 'id': 705}, {'name': 'Warner Bros.', 'id': 6194}, {'name': 'Tribeca Productions', 'id': 11391}, {'name': 'Baltimore Pictures', 'id': 11407}]","[{'iso_3166_1': 'AU', 'name': 'Australia'}, {'iso_3166_1': 'US', 'name': 'United States of America'}]",1999-03-05,176885658.0,103.0,"[{'iso_639_1': 'en', 'name': 'English'}]",Released,New York's most powerful gangster is about to get in touch with his feelings. YOU try telling him his 50 minutes are up.,Analyze This,6.4,512.0,1999,2.211070725,110127.0,Analyze Collection,"Comedy, Crime",Spring Creek Productions,Australia,English
226408,"[{'id': 35, 'name': 'Comedy'}, {'id': 80, 'name': 'Crime'}, {'id': 9648, 'name': 'Mystery'}]",3529,en,"After a four year absence, one time detective Nick Charles returns to New York with his new wife Nora and their dog, Asta. Nick re-connects with many of his old cronies, several of whom are eccentric characters, to say the least. He's also approached by Dorothy Wynant whose inventor father Clyde Wynant is suspected of murdering her step-mother. Her father had left on a planned trip some months before and she has had no contact with him. Nick isn't all that keen on resuming his former profession but egged-on by wife Nora, who thinks this all very exciting, he agrees to help out. He solves the case, announcing the identity of the killer at a dinner party for all of the suspects.",10.573867,"[{'name': 'Metro-Goldwyn-Mayer (MGM)', 'id': 8411}]","[{'iso_3166_1': 'US', 'name': 'United States of America'}]",1934-05-25,1423000.0,93.0,"[{'iso_639_1': 'en', 'name': 'English'}]",Released,A laugh tops every thrilling moment!,The Thin Man,7.4,97.0,1934,6.285113600226141,47814.0,The Thin Man Collection,"Comedy, Crime, Mystery",Metro-Goldwyn-Mayer (MGM),United States of America,English
100000000,"[{'id': 16, 'name': 'Animation'}, {'id': 35, 'name': 'Comedy'}]",9836,en,"Into the world of the Emperor Penguins, who find their soul mates through song, a penguin is born who cannot sing. But he can tap dance something fierce!",15.088318,"[{'name': 'Kennedy Miller Productions', 'id': 2537}, {'name': 'Animal Logic', 'id': 8089}]","[{'iso_3166_1': 'AU', 'name': 'Australia'}]",2006-11-16,384335608.0,108.0,"[{'iso_639_1': 'en', 'name': 'English'}]",Released,WARNING: May Cause Toe-Tapping.,Happy Feet,5.9,1457.0,2006,3.84335608,92012.0,Happy Feet Collection,"Animation, Comedy",Kennedy Miller Productions,Australia,English
