budget,genres,id,original_language,overview,popularity,production_companies,production_countries,release_date,revenue,runtime,spoken_languages,status,tagline,title,vote_average,vote_count,release_year,return,id_collection,name_collection,genres_cleaned,producer_cleaned,Country_cleaned,Language_cleaned
37000000,"[{'id': 18, 'name': 'Drama'}, {'id': 10751, 'name': 'Family'}]",62837,en,A story centered on the friendship between a boy and a dolphin whose tail was lost in a crab trap.,6.695229,"[{'name': 'Alcon Entertainment', 'id': 1088}, {'name': 'Arc Productions', 'id': 10280}]","[{'iso_3166_1': 'US', 'name': 'United States of America'}]",2011-09-23,95404397.0,113.0,"[{'iso_639_1': 'en', 'name': 'English'}]",Released,Inspired by the amazing true story of Winter.,Dolphin Tale,6.6,166.0,2011,2.578497216216216,288491.0,Dolphin Tale Collection,"Drama, Family",Alcon Entertainment,United States of America,English
13500000,"[{'id': 878, 'name': 'Science Fiction'}, {'id': 28, 'name': 'Action'}, {'id': 12, 'name': 'Adventure'}, {'id': 35, 'name': 'Comedy'}, {'id': 10751, 'name': 'Family'}]",1498,en,A quartet of mutated humanoid turtles clash with an uprising criminal gang of ninjas,13.184585,"[{'name': 'New Line Cinema', 'id': 12}, {'name': 'Golden Harvest Company', 'id': 2521}]","[{'iso_3166_1': 'HK', 'name': 'Hong Kong'}, {'iso_3166_1': 'US', 'name': 'United States of America'}]",1990-03-30,202000000.0,93.0,"[{'iso_639_1': 'fr', 'name': 'Français'}, {'iso_639_1': 'en', 'name': 'English'}]",Released,Heroes in a half shell!,Teenage Mutant Ninja Turtles,6.5,486.0,1990,14.962962962962964,1582.0,Teenage Mutant Ninja Turtles (Original) Collection,"Science Fiction, Action, Adventure, Comedy, Family",New Line Cinema,Hong Kong,Français
1800000,"[{'id': 27, 'name': 'Horror'}]",377,en,"Teenagers in a small town are dropping like flies, apparently in the grip of mass hysteria causing their suicides. A cop's daughter, Nancy Thompson (Heather Langenkamp) traces the cause to child molester Fred Krueger (Robert Englund), who was burned alive by angry parents many years before. Krueger has now come back in the dreams of his killers' children, claiming their lives as his revenge. Nancy and her boyfriend, Glen (Johnny Depp), must devise a plan to lure the monster out of the realm of nightmares and into the real world...",13.694713,"[{'name': 'New Line Cinema', 'id': 12}, {'name': 'Smart Egg Pictures', 'id': 1531}]","[{'iso_3166_1': 'US', 'name': 'United States of America'}]",1984-11-14,25504513.0,91.0,"[{'iso_639_1': 'en', 'name': 'English'}]",Released,"If Nancy Doesn't Wake Up Screaming, She Won't Wake Up At All!",A Nightmare on Elm Street,7.2,1212.0,1984,14.169173888888889,8581.0,A Nightmare on Elm Street Collection,Horror,New Line Cinema,United States of America,English
3500000,"[{'id': 14, 'name': 'Fantasy'}, {'id': 27, 'name': 'Horror'}]",26515,en,A man conjures up a gigantic vengeance demon called Pumpkinhead to destroy the teenagers who accidentally killed his son.,11.841506,"[{'name': 'De Laurentiis Entertainment Group (DEG)', 'id': 484}, {'name': 'Lion Films', 'id': 29393}]","[{'iso_3166_1': 'US', 'name': 'United States of America'}]",1988-06-09,4385516.0,86.0,"[{'iso_639_1': 'en', 'name': 'English'}]",Released,For each of man's evils a special demon exists...,Pumpkinhead,5.9,108.0,1988,1.2530045714285714,123256.0,Pumpkinhead Collection,"Fantasy, Horror",De Laurentiis Entertainment Group (DEG),United States of America,English
18000000,"[{'id': 10749, 'name': 'Romance'}, {'id': 10402, 'name': 'Music'}, {'id': 10751, 'name': 'Family'}]",10028,en,"Honey Daniels (Jessica Alba) dreams of making a name for herself as a hip-hop choreographer. When she's not busy hitting downtown clubs with her friends, she teaches dance classes at a nearby community center in Harlem, N.Y., as a way to keep kids off the streets. Honey thinks she's hit the jackpot when she meets a hotshot director (David Moscow) who casts her in one of his music videos. But, when he starts demanding sexual favors from her, Honey makes a decision that will change her life.",11.863954,"[{'name': 'Universal Pictures', 'id': 33}, {'name': 'Marc Platt Productions', 'id': 2527}, {'name': 'NuAmerica Entertainment', 'id': 41963}]","[{'iso_3166_1': 'US', 'name': 'United States of America'}]",2003-11-24,62646763.0,94.0,"[{'iso_639_1': 'en', 'name': 'English'}]",Released,Her dream. Her terms,Honey,6.0,313.0,2003,3.480375722222222,144689.0,Honey Collection,"Romance, Music, Family",Universal Pictures,United States of America,English
103000000,"[{'id': 35, 'name': 'Comedy'}]",109439,en,"This time, there's no wedding. No bachelor party. What could go wrong, right? But when the Wolfpack hits the road, all bets are off.",25.085639,"[{'name': 'Legendary Pictures', 'id': 923}, {'name': 'Green Hat Films', 'id': 3527}]","[{'iso_3166_1': 'US', 'name': 'United States of America'}]",2013-05-23,362000072.0,100.0,"[{'iso_639_1': 'en', 'name': 'English'}]",Released,It all ends.,The Hangover Part III,6.0,2991.0,2013,3.514563805825243,86119.0,The Hangover Collection,Comedy,Legendary Pictures,United States of America,English
80000000,"[{'id': 35, 'name': 'Comedy'}]",38365,en,"After their high school basketball coach passes away, five good friends and former teammates reunite for a Fourth of July holiday weekend.",23.981251,"[{'name': 'Columbia Pictures', 'id': 5}, {'name': 'Happy Madison Productions', 'id': 2608}, {'name': 'Relativity Media', 'id': 7295}]","[{'iso_3166_1': 'US', 'name': 'United States of America'}]",2010-06-24,271430189.0,102.0,"[{'iso_639_1': 'en', 'name': 'English'}]",Released,Boys will be boys. . . some longer than others.,Grown Ups,6.0,1746.0,2010,3.3928773625,180546.0,Grown Ups Collection,Comedy,Columbia Pictures,United States of America,English
7000000,"[{'id': 28, 'name': 'Action'}, {'id': 53, 'name': 'Thriller'}, {'id': 878, 'name': 'Science Fiction'}]",51620,en,"In the world's most dangerous prison, a new game is born: Death Race. The rules of this adrenaline-fueled blood sport are simple, drive or die. When repentant convict Carl Lucas discovers there's a price on his head, his only hope is to survive a twisted race against an army of hardened criminals and tricked-out cars.",11.086032,"[{'name': 'Moonlighting Films', 'id': 9137}, {'name': 'CC Capital Arts Entertainment SRL', 'id': 17008}]","[{'iso_3166_1': 'ZA', 'name': 'South Africa'}, {'iso_3166_1': 'DE', 'name': 'Germany'}]",2010-11-12,0.0,96.0,"[{'iso_639_1': 'en', 'name': 'English'}]",Released,"10 killer drivers, 20,000 rounds of ammo. 1 survivor.",Death Race 2,5.5,323.0,2010,0.0,86116.0,Death Race Collection,"Action, Thriller, Science Fiction",Moonlighting Films,South Africa,English
9023199,"[{'id': 28, 'name': 'Action'}, {'id': 35, 'name': 'Comedy'}]",18707,cn,"The third installment in the Lucky Stars series, following Winners and Sinners (1983) and My Lucky Stars (1985)... The team are released from prison to play detective in order to stop a ruthless gang from ruining their reputations, taking their lives, and that of a key witness in an upcoming trial. They must battle their way through and with the help of Muscles, take down the bad guys.",3.575166,"[{'name': 'Golden Harvest Company', 'id': 2521}, {'name': 'Paragon Films Ltd.', 'id': 3055}, {'name': 'Bojon Films Company Ltd.', 'id': 37065}]","[{'iso_3166_1': 'HK', 'name': 'Hong Kong'}]",1985-08-15,0.0,105.0,"[{'iso_639_1': 'ja', 'name': '日本語'}, {'iso_639_1': 'cn', 'name': '广州话 / 廣州話'}, {'iso_639_1': 'en', 'name': 'English'}]",Released,This time those cock-eyed crime-busters land in more trouble than anyone could safely handle.,"Twinkle, Twinkle, Lucky Stars",6.4,18.0,1985,0.0,300431.0,Lucky Stars Collection,"Action, Comedy",Golden Harvest Company,Hong Kong,日本語
1000000,"[{'id': 53, 'name': 'Thriller'}, {'id': 27, 'name': 'Horror'}]",50698,en,A crew from a paranormal reality television show lock themselves in a haunted psychiatric hospital. They search for evidence of paranormal activity as they shoot what ends up becoming their final episode.,5.324419,"[{'name': 'Darclight', 'id': 6448}, {'name': 'Twin Engine Films', 'id': 12881}, {'name': 'Digital Interference Productions', 'id': 52207}]","[{'iso_3166_1': 'CA', 'name': 'Canada'}, {'iso_3166_1': 'US', 'name': 'United States of America'}]",2011-09-09,0.0,92.0,"[{'iso_639_1': 'en', 'name': 'English'}]",Released,They Were Searching For Proof.  They Found it.,Grave Encounters,6.2,385.0,2011,0.0,135466.0,Grave Encounters Collection,"Thriller, Horror",Darclight,Canada,English
1100000,"[{'id': 14, 'name': 'Fantasy'}, {'id': 27, 'name': 'Horror'}]",33061,en,"When a family moves into a San Francisco apartment, an opportunistic troll decides to make his move and take possession of little Wendy (Jenny Beck), thereby paving the way for new troll recruits, the first in his army that will take eventual control of the planet. We soon discover Torok is the ex-husband of Eunice St. Clair, a resident in the building who was married to Torok.",10.254424,"[{'name': 'Empire Pictures', 'id': 1212}, {'name': 'Altar Productions', 'id': 13085}]","[{'iso_3166_1': 'IT', 'name': 'Italy'}, {'iso_3166_1': 'US', 'name': 'United States of America'}]",1986-01-17,5450815.0,82.0,"[{'iso_639_1': 'en', 'name': 'English'}]",Released,"Worlds of Magic, Mystery and Menace.",Troll,4.9,60.0,1986,4.955286363636364,123218.0,Troll Collection,"Fantasy, Horror",Empire Pictures,Italy,English
25000000,"[{'id': 28, 'name': 'Action'}, {'id': 35, 'name': 'Comedy'}, {'id': 10752, 'name': 'War'}]",9255,en,"Topper Harley is found to be working as an odd-job-man in a monastery. The CIA want him to lead a rescue mission into Iraq, to rescue the last rescue team, who went in to rescue the last rescue team who... who went in to rescue hostages left behind after Desert Storm.",13.482371,"[{'name': 'Twentieth Century Fox Film Corporation', 'id': 306}, {'name': 'Sidley Wright & Associates', 'id': 11751}]","[{'iso_3166_1': 'US', 'name': 'United States of America'}]",1993-05-21,133752825.0,86.0,"[{'iso_639_1': 'en', 'name': 'English'}]",Released,Just deux it.,Hot Shots! Part Deux,6.2,463.0,1993,5.350113,52988.0,Hot Shots! Collection,"Action, Comedy, War",Twentieth Century Fox Film Corporation,United States of America,English
3500000,"[{'id': 28, 'name': 'Action'}, {'id': 12, 'name': 'Adventure'}, {'id': 16, 'name': 'Animation'}]",45162,en,"Batman discovers a mysterious teen-aged girl with superhuman powers and a connection to Superman. When the girl comes to the attention of Darkseid, the evil overlord of Apokolips, events take a decidedly dangerous turn.",5.860115,"[{'name': 'DC Comics', 'id': 429}, {'name': 'Warner Premiere', 'id': 4811}]","[{'iso_3166_1': 'US', 'name': 'United States of America'}]",2010-09-28,0.0,78.0,"[{'iso_639_1': 'en', 'name': 'English'}]",Released,The end is near.,Superman/Batman: Apocalypse,7.0,171.0,2010,0.0,290933.0,Superman / Batman (Animated) Collection,"Action, Adventure, Animation",DC Comics,United States of America,English
10000000,"[{'id': 27, 'name': 'Horror'}, {'id': 878, 'name': 'Science Fiction'}, {'id': 53, 'name': 'Thriller'}]",10706,en,"When a cockroach-spread plague threatened to decimate the child population of New York City in the original Mimic, biologist Susan Tyler and her research associates developed a species of ""Judas"" bugs and introduced them into the environment, where they were to ""mimic"" the diseased roaches and infiltrate their grubby habitats. The plan worked until the bugs evolved to mimic their next prey.....humans! Just when they were all thought to be dead, the giant cockroaches are back, and this time they've mutated to take on human form!",4.88911,"[{'name': 'Neo Art & Logic', 'id': 2811}, {'name': 'Dimension Films', 'id': 7405}]","[{'iso_3166_1': 'US', 'name': 'United States of America'}]",2001-07-17,0.0,82.0,"[{'iso_639_1': 'en', 'name': 'English'}, {'iso_639_1': 'es', 'name': 'Español'}]",Released,Nothing will stop them...,Mimic 2,4.8,54.0,2001,0.0,10721.0,Mimic Collection,"Horror, Science Fiction, Thriller",Neo Art & Logic,United States of America,English
500,"[{'id': 27, 'name': 'Horror'}, {'id': 9648, 'name': 'Mystery'}, {'id': 80, 'name': 'Crime'}]",57313,en,"A group of paranormal investigators enter the abandoned home of paedophile and serial killer John Gacy, hoping to find evidence of paranormal activity. Upon entering the house they set-up cameras throughout the abandoned house while going room to room with hand-held cameras, performing séance's and asking for John Gacy to come forward. As the evening progresses it seems the investigators are not prepared for the horror still within the house.",1.184452,"[{'name': 'The Asylum', 'id': 1311}]","[{'iso_3166_1': 'US', 'name': 'United States of America'}]",2010-09-28,0.0,85.0,"[{'iso_639_1': 'en', 'name': 'English'}]",Released,"In 2004, A film crew set out to find the ghost of John Wayne Gace. They did.",8213: Gacy House,3.2,18.0,2010,0.0,294918.0,Paranormal Investigations Collection,"Horror, Mystery, Crime",The Asylum,United States of America,English
3500000,"[{'id': 35, 'name': 'Comedy'}, {'id': 80, 'name': 'Crime'}]",27561,en,"Ricky, Julian and Bubbles are about to get out of jail, and this time, Julian vows to go straight, even open a legit business. Soon the Boys will all be rich. At least that's what they've told the parole board. But when they arrive back at the park, they find it's not the same old Sunnyvale - and it's not the same old Jim Lahey, Trailer Park Supervisor.",3.093829,"[{'name': 'Topsail Entertainment', 'id': 4518}, {'name': 'Trailer Park Productions', 'id': 64031}]","[{'iso_3166_1': 'CA', 'name': 'Canada'}]",2009-09-25,0.0,101.0,"[{'iso_639_1': 'en', 'name': 'English'}]",Released,The only difference between you and them is a coupla drinks.,Trailer Park Boys: Countdown to Liquor Day,7.0,42.0,2009,0.0,101385.0,Trailer Park Boys Collection,"Comedy, Crime",Topsail Entertainment,Canada,English
53000000,"[{'id': 35, 'name': 'Comedy'}, {'id': 80, 'name': 'Crime'}]",4551,en,"Disenchanted with the movie industry, Chili Palmer tries the music industry, meeting and romancing a widow of a music exec on the way.",13.314233,"[{'name': 'Double Feature Films', 'id': 215}, {'name': 'Jersey Films', 'id': 216}, {'name': 'Nina Saxon Film Design', 'id': 1693}, {'name': 'Metro-Goldwyn-Mayer (MGM)', 'id': 8411}]","[{'iso_3166_1': 'US', 'name': 'United States of America'}]",2005-03-04,95226116.0,118.0,"[{'iso_639_1': 'en', 'name': 'English'}, {'iso_639_1': 'ru', 'name': 'Pусский'}]",Released,Everyone is looking for the next big hit,Be Cool,5.4,296.0,2005,1.7967191698113207,91698.0,Chili Palmer Collection,"Comedy, Crime",Double Feature Films,United States of America,English
60000000,"[{'id': 28, 'name': 'Action'}, {'id': 12, 'name': 'Adventure'}, {'id': 80, 'name': 'Crime'}, {'id': 18, 'name': 'Drama'}, {'id': 9648, 'name': 'Mystery'}, {'id': 53, 'name': 'Thriller'}]",11679,en,"Ice Cube stars as Darius Stone, a thrill-seeking troublemaker whose criminal record and extreme sports obsession make him the perfect candidate to be the newest XXX agent. He must save the U.S. government from a deadly conspiracy led by five-star general and Secretary of Defense George Deckert (played by Willem Dafoe).",19.144611,"[{'name': 'Original Film', 'id': 333}, {'name': 'Columbia Pictures Corporation', 'id': 441}, {'name': 'Revolution Studios', 'id': 497}]","[{'iso_3166_1': 'US', 'name': 'United States of America'}]",2005-04-27,71073932.0,101.0,"[{'iso_639_1': 'en', 'name': 'English'}]",Released,Prepare for the next level,xXx: State of the Union,4.7,565.0,2005,1.1845655333333334,52785.0,xXx Collection,"Action, Adventure, Crime, Drama, Mystery, Thriller",Original Film,United States of America,English
145000000,"[{'id': 16, 'name': 'Animation'}, {'id': 10751, 'name': 'Family'}]",80321,en,"Alex, Marty, Gloria and Melman are still trying to get back to the Big Apple and their beloved Central Park zoo, but first they need to find the penguins. When they travel to Monte Carlo, they attract the attention of Animal Control after gate crashing a party and are joined by the penguins, King Julian and Co., and the monkeys. How do a lion, zebra, hippo, giraffe, four penguins, two monkeys, three lemurs travel through Europe without attracting attention and get back to New York? They join a traveling circus. Their attempts to get back to New York are consistently hampered by the Captain of Animal Control who wants to make Alex part of her collection. Once they make it back to New York Marty, Alex, Gloria and Melman realize that they want to be part of the traveling circus.",13.829042,"[{'name': 'DreamWorks Animation', 'id': 521}]","[{'iso_3166_1': 'US', 'name': 'United States of America'}]",2012-06-06,746921274.0,93.0,"[{'iso_639_1': 'en', 'name': 'English'}, {'iso_639_1': 'es', 'name': 'Español'}, {'iso_639_1': 'th', 'name': 'ภาษาไทย'}]",Released,"Six years ago, they disappeared without a trace. Next summer, they finally resurface.",Madagascar 3: Europe's Most Wanted,6.4,1857.0,2012,5.1511812,14740.0,Madagascar Collection,"Animation, Family",DreamWorks Animation,United States of America,English
30000000,"[{'id': 14, 'name': 'Fantasy'}, {'id': 18, 'name': 'Drama'}, {'id': 35, 'name': 'Comedy'}, {'id': 10751, 'name': 'Family'}]",9598,en,"Babe is a little pig who doesn't quite know his place in the world. With a bunch of odd friends, like Ferdinand the duck who thinks he is a rooster and Fly the dog he calls mom, Babe realizes that he has the makings to become the greatest sheep pig of all time, and Farmer Hogget knows it. With the help of the sheep dogs Babe learns that a pig can be anything that he wants to be.",14.404764,"[{'name': 'Universal Pictures', 'id': 33}, {'name': 'Kennedy Miller Productions', 'id': 2537}]","[{'iso_3166_1': 'AU', 'name': 'Australia'}, {'iso_3166_1': 'US', 'name': 'United States of America'}]",1995-07-18,254134910.0,89.0,"[{'iso_639_1': 'en', 'name': 'English'}]",Released,A little pig goes a long way.,Babe,6.0,756.0,1995,8.471163666666667,9435.0,Babe Collection,"Fantasy, Drama, Comedy, Family",Universal Pictures,Australia,English
13000000,"[{'id': 18, 'name': 'Drama'}, {'id': 10402, 'name': 'Music'}]",1931,en,"After the death of his younger brother, a troubled 19-year-old street dancer from Los Angeles is able to bypass juvenile hall by enrolling in the historically black, Truth University in Atlanta, Georgia. But his efforts to get an education and woo the girl he likes are sidelined when he is courted by the top two campus fraternities, both of which want and need his fierce street-style dance moves to win the highly coveted national step show competition.",5.607508,"[{'name': 'Rainforest Films', 'id': 1309}]","[{'iso_3166_1': 'US', 'name': 'United States of America'}]",2007-05-16,75511123.0,114.0,"[{'iso_639_1': 'en', 'name': 'English'}]",Released,He will challenge their traditions. Their traditions will change his life.,Stomp the Yard,6.1,90.0,2007,5.808547923076923,160727.0,Stomp the Yard Collection,"Drama, Music",Rainforest Films,United States of America,English
45000000,"[{'id': 18, 'name': 'Drama'}]",10802,en,A young drifter named Nomi arrives in Las Vegas to become a dancer and soon sets about clawing and pushing her way to become a top showgirl.,17.502375,"[{'name': 'United Artists', 'id': 60}, {'name': 'Le Studio Canal+', 'id': 183}, {'name': 'Carolco Pictures', 'id': 14723}]","[{'iso_3166_1': 'FR', 'name': 'France'}, {'iso_3166_1': 'US', 'name': 'United States of America'}]",1995-09-22,20350754.0,128.0,"[{'iso_639_1': 'en', 'name': 'English'}]",Released,Beyond your wildest dreams. Beyond your wildest fantasies.,Showgirls,4.9,261.0,1995,0.4522389777777778,247294.0,Showgirls Collection,Drama,United Artists,France,English
30000000,"[{'id': 16, 'name': 'Animation'}, {'id': 35, 'name': 'Comedy'}, {'id': 10751, 'name': 'Family'}]",11836,en,"There's trouble brewing in Bikini Bottom. Someone has stolen King Neptune's crown, and it looks like Mr. Krab, SpongeBob's boss, is the culprit. Though he's just been passed over for the promotion of his dreams, SpongeBob stands by his boss, and along with his best pal Patrick, sets out on a treacherous mission to Shell City to reclaim the crown and save Mr. Krab's life.",11.213712,"[{'name': 'Paramount Pictures', 'id': 4}, {'name': 'Nickelodeon Movies', 'id': 2348}, {'name': 'United Plankton Pictures', 'id': 8921}]","[{'iso_3166_1': 'US', 'name': 'United States of America'}]",2004-11-14,140161792.0,87.0,"[{'iso_639_1': 'en', 'name': 'English'}]",Released,Bigger. Better. More absorbent.,The SpongeBob SquarePants Movie,6.7,593.0,2004,4.672059733333334,275402.0,SpongeBob Collection,"Animation, Comedy, Family",Paramount Pictures,United States of America,English
75000000,"[{'id': 28, 'name': 'Action'}, {'id': 12, 'name': 'Adventure'}, {'id': 35, 'name': 'Comedy'}, {'id': 10751, 'name': 'Family'}]",332,en,"John Brown is a bumbling but well-intentioned security guard who is badly injured in an explosion planned by an evil mastermind. He is taken to a laboratory, where Brenda, a leading robotics surgeon, replaces his damaged limbs with state-of-the-art gadgets and tools. Named ""Inspector Gadget"" by the press, John -- along with his niece, Penny, and her trusty dog, Brain -- uses his new powers to discover who was behind the explosion.",11.677244,"[{'name': 'Walt Disney Pictures', 'id': 2}, {'name': 'Caravan Pictures', 'id': 175}, {'name': 'DiC Entertainment', 'id': 20477}]","[{'iso_3166_1': 'US', 'name': 'United States of America'}]",1999-07-23,0.0,78.0,"[{'iso_639_1': 'en', 'name': 'English'}, {'iso_639_1': 'no', 'name': 'Norsk'}, {'iso_639_1': 'fr', 'name': 'Français'}, {'iso_639_1': 'es', 'name': 'Español'}]",Released,The greatest hero ever assembled.,Inspector Gadget,4.3,322.0,1999,0.0,237445.0,Inspector Gadget Collection,"Action, Adventure, Comedy, Family",Walt Disney Pictures,United States of America,English
5000000,"[{'id': 878, 'name': 'Science Fiction'}]",35610,en,"It is several years after the events of the first movie, and David Herdeg (the survivor of the Philadelphia Experiment from the first film) and Allison (the woman from 1984 he fell in love with) have married and have a child. David awakes, in agony, to a changed world. Germany won World War II and the United States is now about to mark 50 years as a Nazi conquest.",1.155075,"[{'name': 'Trimark Pictures', 'id': 4063}]","[{'iso_3166_1': 'US', 'name': 'United States of America'}]",1993-11-12,2970.0,97.0,"[{'iso_639_1': 'de', 'name': 'Deutsch'}, {'iso_639_1': 'en', 'name': 'English'}]",Released,They cut a hole through time,Philadelphia Experiment II,5.0,15.0,1993,0.000594,145784.0,The Philadelphia Experiment - Collezione,Science Fiction,Trimark Pictures,United States of America,Deutsch
6000000,"[{'id': 28, 'name': 'Action'}, {'id': 12, 'name': 'Adventure'}, {'id': 18, 'name': 'Drama'}, {'id': 53, 'name': 'Thriller'}]",7227,en,Flight 23 has crashed in the Bermuda Triangle while taking VIPs and valuable art to Philip Stevens new museum. But when hijackers take off the plane and knock everyone out with sleeping gas the plane crashes in the sea. The passengers survive but a small hole at the front is flooding the plane and 2 daring rescues must be put into action because everyone is trapped 200 feet underwater.,9.394776,"[{'name': 'Universal Pictures', 'id': 33}]","[{'iso_3166_1': 'US', 'name': 'United States of America'}]",1977-03-11,30000000.0,114.0,"[{'iso_639_1': 'en', 'name': 'English'}, {'iso_639_1': 'hu', 'name': 'Magyar'}]",Released,"Flight 23 has crashed in the Bermuda Triangle... passengers still alive, trapped underwater...",Airport '77,5.8,69.0,1977,5.0,33938.0,Airport Collection,"Action, Adventure, Drama, Thriller",Universal Pictures,United States of America,English
80000000,"[{'id': 28, 'name': 'Action'}, {'id': 16, 'name': 'Animation'}, {'id': 35, 'name': 'Comedy'}, {'id': 10751, 'name': 'Family'}, {'id': 14, 'name': 'Fantasy'}]",324849,en,"In the irreverent spirit of fun that made “The Lego Movie” a worldwide phenomenon, the self-described leading man of that ensemble—Lego Batman—stars in his own big-screen adventure. But there are big changes brewing in Gotham, and if he wants to save the city from The Joker’s hostile takeover, Batman may have to drop the lone vigilante thing, try to work with others and maybe, just maybe, learn to lighten up.",17.070748,"[{'name': 'Lin Pictures', 'id': 2723}, {'name': 'Warner Bros. Animation', 'id': 2785}, {'name': 'Warner Bros.', 'id': 6194}, {'name': 'Animal Logic', 'id': 8089}, {'name': 'DC Entertainment', 'id': 9993}, {'name': 'Lord Miller', 'id': 77973}, {'name': 'LEGO System A/S', 'id': 85983}]","[{'iso_3166_1': 'DK', 'name': 'Denmark'}, {'iso_3166_1': 'US', 'name': 'United States of America'}]",2017-02-08,311950384.0,104.0,"[{'iso_639_1': 'en', 'name': 'English'}]",Released,Always be yourself. Unless you can be Batman.,The Lego Batman Movie,7.2,1473.0,2017,3.8993798,325470.0,The Lego Movie Collection,"Action, Animation, Comedy, Family, Fantasy",Lin Pictures,Denmark,English
