budget,genres,id,original_language,overview,popularity,production_companies,production_countries,release_date,revenue,runtime,spoken_languages,status,tagline,title,vote_average,vote_count,release_year,return,id_collection,name_collection,genres_cleaned,producer_cleaned,Country_cleaned,Language_cleaned
190000000,"[{'id': 28, 'name': 'Action'}, {'id': 12, 'name': 'Adventure'}, {'id': 878, 'name': 'Science Fiction'}]",54138,en,"When the crew of the Enterprise is called back home, they find an unstoppable force of terror from within their own organization has detonated the fleet and everything it stands for, leaving our world in a state of crisis.  With a personal score to settle, Captain Kirk leads a manhunt to a war-zone world to capture a one man weapon of mass destruction. As our heroes are propelled into an epic chess game of life and death, love will be challenged, friendships will be torn apart, and sacrifices must be made for the only family Kirk has left: his crew.",15.78129,"[{'name': 'Paramount Pictures', 'id': 4}, {'name': 'Skydance Productions', 'id': 6277}, {'name': 'Bad Robot', 'id': 11461}, {'name': 'Kurtzman/Orci', 'id': 12536}]","[{'iso_3166_1': 'US', 'name': 'United States of America'}]",2013-05-05,467365246.0,132.0,"[{'iso_639_1': 'en', 'name': 'English'}]",Released,Earth Will Fall,Star Trek Into Darkness,7.4,4479.0,2013,2.4598170842105263,115575.0,Star Trek: Alternate Reality Collection,"Action, Adventure, Science Fiction",Paramount Pictures,United States of America,English
20000000,"[{'id': 27, 'name': 'Horror'}, {'id': 35, 'name': 'Comedy'}]",40264,en,"Becca, an anxious, non-vampire teen is torn between two boys. Before she can choose, Becca must get around her controlling father, who embarrasses Becca by treating her like a child. Meanwhile, Becca's friends contend with their own romantic issues - all of which collide at the prom.",8.129407,"[{'name': 'Regency Enterprises', 'id': 508}, {'name': 'Road Rebel', 'id': 2648}]","[{'iso_3166_1': 'US', 'name': 'United States of America'}]",2010-08-18,80547866.0,82.0,"[{'iso_639_1': 'en', 'name': 'English'}, {'iso_639_1': 'es', 'name': 'Español'}]",Released,Some sagas just won't die.,Vampires Suck,4.2,326.0,2010,4.0273933,278920.0,Vampires Suck Collection,"Horror, Comedy",Regency Enterprises,United States of America,English
35000,"[{'id': 35, 'name': 'Comedy'}, {'id': 27, 'name': 'Horror'}]",27813,en,A young man carrying a big basket that contains his deformed Siamese-twin brother seeks vengeance on the doctors who separated them against their will.,6.631724,"[{'name': 'Basket Case Productions', 'id': 37061}]","[{'iso_3166_1': 'US', 'name': 'United States of America'}]",1982-04-14,0.0,91.0,"[{'iso_639_1': 'en', 'name': 'English'}]",Released,"The tenant in room 7 is very small, very twisted and very mad.",Basket Case,6.2,75.0,1982,0.0,104716.0,Basket Case Collection,"Comedy, Horror",Basket Case Productions,United States of America,English
63000000,"[{'id': 12, 'name': 'Adventure'}, {'id': 878, 'name': 'Science Fiction'}]",329,en,"A wealthy entrepreneur secretly creates a theme park featuring living dinosaurs drawn from prehistoric DNA. Before opening day, he invites a team of experts and his two eager grandchildren to experience the park and help calm anxious investors. However, the park is anything but amusing as the security systems go off-line and the dinosaurs escape.",8.863776,"[{'name': 'Universal Pictures', 'id': 33}, {'name': 'Amblin Entertainment', 'id': 56}]","[{'iso_3166_1': 'US', 'name': 'United States of America'}]",1993-06-11,920100000.0,127.0,"[{'iso_639_1': 'en', 'name': 'English'}, {'iso_639_1': 'es', 'name': 'Español'}]",Released,An adventure 65 million years in the making.,Jurassic Park,7.6,4956.0,1993,14.604761904761904,328.0,Jurassic Park Collection,"Adventure, Science Fiction",Universal Pictures,United States of America,English
70000000,"[{'id': 35, 'name': 'Comedy'}, {'id': 10751, 'name': 'Family'}, {'id': 10749, 'name': 'Romance'}, {'id': 14, 'name': 'Fantasy'}]",10808,en,"Dr. John Dolittle the beloved doctor is back, but this time around he plays cupid to bumbling circus bear Archie as he's so smitten by a Pacific Western bear female, Ava. Dr. Dolittle must help a group of forest creatures to save their forest. But with the aid of his mangy, madcap animal friends, Dr. Dolittle must teach Archie the ways of true romance in time to save his species and his home before their habit is gone. So John held a meeting for every animal in the forest to not give up without a fight no matter what kind of animal expression they have and everyone agrees to do it and save their home.",7.906683,"[{'name': 'Twentieth Century Fox Film Corporation', 'id': 306}, {'name': 'Joseph M. Singer Entertainment', 'id': 1301}, {'name': 'Davis Entertainment', 'id': 1302}]","[{'iso_3166_1': 'US', 'name': 'United States of America'}]",2001-06-22,176104344.0,87.0,"[{'iso_639_1': 'en', 'name': 'English'}]",Released,The doctor is in again.,Dr. Dolittle 2,4.9,422.0,2001,2.515776342857143,3169.0,Dr. Dolittle Collection,"Comedy, Family, Romance, Fantasy",Twentieth Century Fox Film Corporation,United States of America,English
5000000,"[{'id': 27, 'name': 'Horror'}, {'id': 53, 'name': 'Thriller'}]",91586,en,The haunted Lambert family seeks to uncover the mysterious childhood secret that has left them dangerously connected to the spirit world.,9.040324,"[{'name': 'Sony Pictures', 'id': 34}, {'name': 'FilmDistrict', 'id': 7263}]","[{'iso_3166_1': 'US', 'name': 'United States of America'}]",2013-09-12,0.0,106.0,"[{'iso_639_1': 'en', 'name': 'English'}, {'iso_639_1': 'th', 'name': 'ภาษาไทย'}]",Released,It will take what you love most.,Insidious: Chapter 2,6.5,1237.0,2013,0.0,228446.0,Insidious Collection,"Horror, Thriller",Sony Pictures,United States of America,English
19000000,"[{'id': 27, 'name': 'Horror'}, {'id': 9648, 'name': 'Mystery'}, {'id': 53, 'name': 'Thriller'}]",11377,en,"A remake of the 1959 film of the same name. A millionaire offers a group of diverse people $1,000,000 to spend the night in a haunted house with a horrifying past.",10.187278,"[{'name': 'Dark Castle Entertainment', 'id': 1786}, {'name': 'Warner Bros.', 'id': 6194}]","[{'iso_3166_1': 'US', 'name': 'United States of America'}]",1999-10-29,40846082.0,93.0,"[{'iso_639_1': 'en', 'name': 'English'}]",Released,Evil loves to party.,House on Haunted Hill,5.5,211.0,1999,2.149793789473684,248339.0,House on Haunted Hill Collection,"Horror, Mystery, Thriller",Dark Castle Entertainment,United States of America,English
18000000,"[{'id': 12, 'name': 'Adventure'}, {'id': 28, 'name': 'Action'}, {'id': 878, 'name': 'Science Fiction'}]",1891,en,"The epic saga continues as Luke Skywalker, in hopes of defeating the evil Galactic Empire, learns the ways of the Jedi from aging master Yoda. But Darth Vader is more determined than ever to capture Luke. Meanwhile, rebel leader Princess Leia, cocky Han Solo, Chewbacca, and droids C-3PO and R2-D2 are thrown into various stages of capture, betrayal and despair.",19.470959,"[{'name': 'Lucasfilm', 'id': 1}, {'name': 'Twentieth Century Fox Film Corporation', 'id': 306}]","[{'iso_3166_1': 'US', 'name': 'United States of America'}]",1980-05-17,538400000.0,124.0,"[{'iso_639_1': 'en', 'name': 'English'}]",Released,The Adventure Continues...,The Empire Strikes Back,8.2,5998.0,1980,29.91111111111111,10.0,Star Wars Collection,"Adventure, Action, Science Fiction",Lucasfilm,United States of America,English
85000000,"[{'id': 16, 'name': 'Animation'}, {'id': 35, 'name': 'Comedy'}, {'id': 10751, 'name': 'Family'}]",9408,en,"Cody is a surfing penguin from Shiverpool who dreams of making it big and being like his idol Big Z. On his journey he discovers his talents are not all he thinks they are and he must learn to accept that their is more to surfing than fame and fortune.  Surf's Up is a 2007 American computer-animated mockumentary film produced by Sony Pictures Animation and distributed by Columbia Pictures and ImageWorks Studios. It stars the voices of Shia LaBeouf, Jeff Bridges, Zooey Deschanel, Jon Heder among others.",11.526339,"[{'name': 'Columbia Pictures', 'id': 5}, {'name': 'Sony Pictures Animation', 'id': 2251}]","[{'iso_3166_1': 'US', 'name': 'United States of America'}]",2007-06-08,149044513.0,85.0,"[{'iso_639_1': 'en', 'name': 'English'}]",Released,"In the coldest place on Earth, he's the hottest thing around.",Surf's Up,5.9,616.0,2007,1.7534648588235293,436295.0,Surf's Up Collection,"Animation, Comedy, Family",Columbia Pictures,United States of America,English
66000000,"[{'id': 9648, 'name': 'Mystery'}, {'id': 878, 'name': 'Science Fiction'}, {'id': 53, 'name': 'Thriller'}]",846,en,"Mulder and Scully, now taken off the FBI's X Files cases, must find a way to fight the shadowy elements of the government to find out the truth about a conspiracy that might mean the alien colonization of Earth.",12.311615,"[{'name': 'Twentieth Century Fox Film Corporation', 'id': 306}, {'name': 'Ten Thirteen Productions', 'id': 545}]","[{'iso_3166_1': 'CA', 'name': 'Canada'}, {'iso_3166_1': 'US', 'name': 'United States of America'}]",1998-06-19,189198313.0,121.0,"[{'iso_639_1': 'en', 'name': 'English'}]",Released,Fight the Future,The X Files,6.6,494.0,1998,2.866641106060606,19387.0,The X-Files Collection,"Mystery, Science Fiction, Thriller",Twentieth Century Fox Film Corporation,Canada,English
18000000,"[{'id': 28, 'name': 'Action'}, {'id': 12, 'name': 'Adventure'}, {'id': 80, 'name': 'Crime'}, {'id': 53, 'name': 'Thriller'}]",2019,en,"When a woman's father goes missing, she enlist a local to aid in her search.  The pair soon discover that her father has died at the hands of a wealthy sportsman who hunts homeless men as a form of recreation.",7.834351,"[{'name': 'Universal Pictures', 'id': 33}, {'name': 'Renaissance Pictures', 'id': 467}, {'name': 'Alphaville Films', 'id': 11462}]","[{'iso_3166_1': 'US', 'name': 'United States of America'}]",1993-08-20,74189677.0,97.0,"[{'iso_639_1': 'en', 'name': 'English'}]",Released,Don't hunt what you can't kill.,Hard Target,6.1,237.0,1993,4.121648722222222,412680.0,Hard Target Collection,"Action, Adventure, Crime, Thriller",Universal Pictures,United States of America,English
6400000,"[{'id': 28, 'name': 'Action'}, {'id': 53, 'name': 'Thriller'}, {'id': 878, 'name': 'Science Fiction'}]",218,en,"In the post-apocalyptic future, reigning tyrannical supercomputers teleport a cyborg assassin known as the ""Terminator"" back to 1984 to kill Sarah Connor, whose unborn son is destined to lead insurgents against 21st century mechanical hegemony. Meanwhile, the human-resistance movement dispatches a lone warrior to safeguard Sarah. Can he stop the virtually indestructible killing machine?",19.293562,"[{'name': 'Orion Pictures', 'id': 41}, {'name': 'Pacific Western', 'id': 1280}, {'name': 'Hemdale Film', 'id': 3952}, {'name': 'Cinema 84', 'id': 4764}, {'name': 'Euro Film Funding', 'id': 7745}]","[{'iso_3166_1': 'GB', 'name': 'United Kingdom'}, {'iso_3166_1': 'US', 'name': 'United States of America'}]",1984-10-26,78371200.0,108.0,"[{'iso_639_1': 'en', 'name': 'English'}]",Released,Your future is in his hands.,The Terminator,7.4,4208.0,1984,12.2455,528.0,The Terminator Collection,"Action, Thriller, Science Fiction",Orion Pictures,United Kingdom,English
45000000,"[{'id': 28, 'name': 'Action'}, {'id': 878, 'name': 'Science Fiction'}]",10366,en,"Luc Deveraux, the heroic former Universal Soldier, is about to be thrown into action once again. When Seth (Michael Jai White), the supercomputer controlled ultra-warrior, decides to take revenge and destroy its creators, only Luc can stop it. All hell breaks loose as Luc battles Seth and a deadly team of perfect soldiers in a struggle that pits man against machine and good against evil.",7.805145,"[{'name': 'TriStar Pictures', 'id': 559}, {'name': 'Baumgarten-Prophet Entertainment', 'id': 12968}]","[{'iso_3166_1': 'US', 'name': 'United States of America'}]",1999-08-05,10667893.0,82.0,"[{'iso_639_1': 'en', 'name': 'English'}]",Released,Prepare to become obsolete,Universal Soldier: The Return,4.2,138.0,1999,0.2370642888888889,10713.0,Universal Soldier Collection,"Action, Science Fiction",TriStar Pictures,United States of America,English
21000000,"[{'id': 28, 'name': 'Action'}, {'id': 80, 'name': 'Crime'}, {'id': 53, 'name': 'Thriller'}]",4108,en,"Former Special Forces officer, Frank Martin will deliver anything to anyone for the right price, and his no-questions-asked policy puts him in high demand. But when he realizes his latest cargo is alive, it sets in motion a dangerous chain of events. The bound and gagged Lai is being smuggled to France by a shady American businessman, and Frank works to save her as his own illegal activities are uncovered by a French detective.",13.217421,"[{'name': 'TF1 Films Productions', 'id': 356}, {'name': 'Current Entertainment', 'id': 972}, {'name': 'Canal+', 'id': 5358}, {'name': 'EuropaCorp', 'id': 6896}]","[{'iso_3166_1': 'US', 'name': 'United States of America'}, {'iso_3166_1': 'FR', 'name': 'France'}]",2002-10-02,43928932.0,92.0,"[{'iso_639_1': 'en', 'name': 'English'}, {'iso_639_1': 'fr', 'name': 'Français'}, {'iso_639_1': 'zh', 'name': '普通话'}]",Released,Rules are made to be broken.,The Transporter,6.6,1724.0,2002,2.091853904761905,9518.0,The Transporter Collection,"Action, Crime, Thriller",TF1 Films Productions,United States of America,English
220000000,"[{'id': 878, 'name': 'Science Fiction'}, {'id': 28, 'name': 'Action'}, {'id': 12, 'name': 'Adventure'}]",24428,en,"When an unexpected enemy emerges and threatens global safety and security, Nick Fury, director of the international peacekeeping agency known as S.H.I.E.L.D., finds himself in need of a team to pull the world back from the brink of disaster. Spanning the globe, a daring recruitment effort begins!",89.887648,"[{'name': 'Paramount Pictures', 'id': 4}, {'name': 'Marvel Studios', 'id': 420}]","[{'iso_3166_1': 'US', 'name': 'United States of America'}]",2012-04-25,1519557910.0,143.0,"[{'iso_639_1': 'en', 'name': 'English'}]",Released,Some assembly required.,The Avengers,7.4,12000.0,2012,6.907081409090909,86311.0,The Avengers Collection,"Science Fiction, Action, Adventure",Paramount Pictures,United States of America,English
37000000,"[{'id': 35, 'name': 'Comedy'}, {'id': 14, 'name': 'Fantasy'}]",2978,en,"Five years after they defeated Gozer, the Ghostbusters are out of business. When Dana begins to have ghost problems again, the boys come out of retirement to aid her and hopefully save New York City from a new paranormal threat.",16.414239,"[{'name': 'Columbia Pictures Corporation', 'id': 441}]","[{'iso_3166_1': 'US', 'name': 'United States of America'}]",1989-06-15,215394738.0,108.0,"[{'iso_639_1': 'en', 'name': 'English'}]",Released,We're back!,Ghostbusters II,6.3,1131.0,1989,5.821479405405405,2980.0,Ghostbusters Collection,"Comedy, Fantasy",Columbia Pictures Corporation,United States of America,English
700000,"[{'id': 27, 'name': 'Horror'}]",18477,en,A group of young and wild motocross racers venture through the desert and are stranded at an old mining ranch. They soon realize that they are being watched by a group of savage cannibals unknown to the civilized world. The film is full of flashbacks to the original film; even the dog has a flashback.,3.09433,"[{'name': 'Castle Hill Productions', 'id': 6429}, {'name': 'VTC', 'id': 20716}]","[{'iso_3166_1': 'GB', 'name': 'United Kingdom'}, {'iso_3166_1': 'US', 'name': 'United States of America'}]",1984-06-01,0.0,86.0,"[{'iso_639_1': 'en', 'name': 'English'}]",Released,So you think you're lucky to be alive...,The Hills Have Eyes Part II,4.3,33.0,1984,0.0,267922.0,The Hills Have Eyes (Original) Collection,Horror,Castle Hill Productions,United Kingdom,English
50000,"[{'id': 27, 'name': 'Horror'}]",27548,en,"A student moves into a run-down building in New York City. His bizarre neighbors make a concoction in their apartment they call wine, but when he takes some of it, he turns into a deformed, murderous monster.",1e-06,"[{'name': 'Bare Bones Productions', 'id': 73770}]","[{'iso_3166_1': 'US', 'name': 'United States of America'}]",1988-05-13,0.0,85.0,"[{'iso_639_1': 'en', 'name': 'English'}]",Released,A horror film with guts!,Slime City,4.7,7.0,1988,0.0,425280.0,Slime City Collection,Horror,Bare Bones Productions,United States of America,English
45000000,"[{'id': 35, 'name': 'Comedy'}, {'id': 10751, 'name': 'Family'}, {'id': 10402, 'name': 'Music'}]",64328,en,"When Kermit the Frog and the Muppets learn that their beloved theater is slated for demolition, a sympathetic human, Gary, and his puppet roommate, Walter, swoop in to help the gang put on a show and raise the $10 million they need to save the day.",10.214369,"[{'name': 'Walt Disney Pictures', 'id': 2}]","[{'iso_3166_1': 'US', 'name': 'United States of America'}]",2011-11-22,165184237.0,103.0,"[{'iso_639_1': 'en', 'name': 'English'}]",Released,They're closer than you think.,The Muppets,6.5,509.0,2011,3.6707608222222223,256377.0,The Muppet Collection,"Comedy, Family, Music",Walt Disney Pictures,United States of America,English
4000000,"[{'id': 12, 'name': 'Adventure'}, {'id': 28, 'name': 'Action'}, {'id': 53, 'name': 'Thriller'}, {'id': 80, 'name': 'Crime'}]",482,en,Cool black private eye John Shaft is hired by a crime lord to find and retrieve his kidnapped daughter.,3.73688,"[{'name': 'Metro-Goldwyn-Mayer (MGM)', 'id': 8411}, {'name': 'Shaft Productions Ltd.', 'id': 12145}]","[{'iso_3166_1': 'US', 'name': 'United States of America'}]",1971-07-02,12121618.0,100.0,"[{'iso_639_1': 'en', 'name': 'English'}]",Released,The mob wanted Harlem back. They got shaft...up to here.,Shaft,6.5,68.0,1971,3.0304045,495.0,Shaft Collection,"Adventure, Action, Thriller, Crime",Metro-Goldwyn-Mayer (MGM),United States of America,English
9000000,"[{'id': 35, 'name': 'Comedy'}, {'id': 12, 'name': 'Adventure'}]",11282,en,"Sometimes, it takes a strange night to put everything else into focus. And that's exactly what happens to Harold and his roommate, Kumar, when they set out to get the best stoner fix money can buy: White Castle hamburgers. Both guys are at a crossroads, about to make major decisions that will affect the course of their lives. Yet they arrive at wisdom by accident as they drive around New Jersey in search of fast food.",8.344105,"[{'name': 'New Line Cinema', 'id': 12}]","[{'iso_3166_1': 'US', 'name': 'United States of America'}]",2004-05-30,23936908.0,88.0,"[{'iso_639_1': 'en', 'name': 'English'}, {'iso_639_1': 'hi', 'name': 'हिन्दी'}]",Released,Fast Food. High Times.,Harold & Kumar Go to White Castle,6.6,709.0,2004,2.6596564444444444,30663.0,Harold & Kumar Collection,"Comedy, Adventure",New Line Cinema,United States of America,English
20500000,"[{'id': 53, 'name': 'Thriller'}, {'id': 27, 'name': 'Horror'}]",17692,en,"This third film in the series follows a group of marine biologists attempting to capture a young great white shark that has wandered into Florida's Sea World Park. However, later it is discovered that the shark's 35-foot mother is also a guest at Sea World. What follows is the shark wreaking havoc on the visitors in the park.",16.603041,"[{'name': 'Universal Pictures', 'id': 33}, {'name': 'Alan Landsburg Productions', 'id': 4904}, {'name': 'MCA  Theatricals', 'id': 79415}]","[{'iso_3166_1': 'US', 'name': 'United States of America'}]",1983-03-16,87987055.0,99.0,"[{'iso_639_1': 'en', 'name': 'English'}]",Released,A deadly new attraction.,Jaws 3-D,4.2,266.0,1983,4.2920514634146345,2366.0,The Jaws Collection,"Thriller, Horror",Universal Pictures,United States of America,English
14000000,"[{'id': 12, 'name': 'Adventure'}, {'id': 28, 'name': 'Action'}, {'id': 53, 'name': 'Thriller'}]",691,en,Russian and British submarines with nuclear missiles on board both vanish from sight without a trace. England and Russia both blame each other as James Bond tries to solve the riddle of the disappearing ships. But the KGB also has an agent on the case.,9.781451,"[{'name': 'United Artists', 'id': 60}, {'name': 'Eon Productions', 'id': 7576}, {'name': 'Danjaq', 'id': 10761}]","[{'iso_3166_1': 'GB', 'name': 'United Kingdom'}, {'iso_3166_1': 'US', 'name': 'United States of America'}]",1977-07-07,185438673.0,125.0,"[{'iso_639_1': 'en', 'name': 'English'}, {'iso_639_1': 'it', 'name': 'Italiano'}, {'iso_639_1': 'ar', 'name': 'العربية'}]",Released,It's the BIGGEST. It's the BEST. It's BOND. And B-E-Y-O-N-D.,The Spy Who Loved Me,6.6,515.0,1977,13.2456195,645.0,James Bond Collection,"Adventure, Action, Thriller",United Artists,United Kingdom,English
3500000,"[{'id': 16, 'name': 'Animation'}]",217993,en,"The world is under attack by an alien armada led by the powerful Apokoliptian, Darkseid. A group of superheroes consisting of Superman, Batman, Wonder Woman, The Flash, Green Lantern, Cyborg, and Shazam must set aside their differences and gather together to defend Earth.",8.138622,"[{'name': 'DC Comics', 'id': 429}, {'name': 'Warner Bros. Animation', 'id': 2785}, {'name': 'DC Entertainment', 'id': 9993}]","[{'iso_3166_1': 'US', 'name': 'United States of America'}]",2014-02-02,5155325.0,79.0,"[{'iso_639_1': 'en', 'name': 'English'}, {'iso_639_1': 'de', 'name': 'Deutsch'}]",Released,A time when heroes became legends.,Justice League: War,7.0,234.0,2014,1.47295,256287.0,Justice League (Animated) Collection,Animation,DC Comics,United States of America,English
4000000,"[{'id': 28, 'name': 'Action'}, {'id': 53, 'name': 'Thriller'}, {'id': 80, 'name': 'Crime'}, {'id': 9648, 'name': 'Mystery'}]",33613,sv,"After taking a bullet to the head, Salander is under close supervision in a hospital and is set to face trial for attempted murder on her eventual release. With the help of journalist Mikael Blomkvist and his researchers at Millennium magazine, Salander must prove her innocence. In doing this she plays against powerful enemies and her own past.",8.405013,"[{'name': 'Nordisk Film', 'id': 235}, {'name': 'Sveriges Television (SVT)', 'id': 3221}, {'name': 'Yellow Bird Films', 'id': 5746}, {'name': 'ZDF Enterprises', 'id': 5747}, {'name': 'Film i Väst', 'id': 17513}]","[{'iso_3166_1': 'SE', 'name': 'Sweden'}]",2009-11-27,43498108.0,147.0,"[{'iso_639_1': 'sv', 'name': 'svenska'}]",Released,There's A Storm Coming,The Girl Who Kicked the Hornet's Nest,7.0,451.0,2009,10.874527,24761.0,The Millennium Collection,"Action, Thriller, Crime, Mystery",Nordisk Film,Sweden,svenska
59000000,"[{'id': 16, 'name': 'Animation'}, {'id': 35, 'name': 'Comedy'}, {'id': 10751, 'name': 'Family'}, {'id': 12, 'name': 'Adventure'}]",425,en,"With the impending ice age almost upon them, a mismatched trio of prehistoric critters – Manny the woolly mammoth, Diego the saber-toothed tiger and Sid the giant sloth – find an orphaned infant and decide to return it to its human parents. Along the way, the unlikely allies become friends but, when enemies attack, their quest takes on far nobler aims.",17.328902,"[{'name': 'Twentieth Century Fox Film Corporation', 'id': 306}, {'name': 'Blue Sky Studios', 'id': 9383}, {'name': 'Twentieth Century Fox Animation', 'id': 11749}]","[{'iso_3166_1': 'US', 'name': 'United States of America'}]",2002-03-10,383257136.0,81.0,"[{'iso_639_1': 'en', 'name': 'English'}]",Released,They came. They thawed. They conquered.,Ice Age,7.1,3954.0,2002,6.495883661016949,8354.0,Ice Age Collection,"Animation, Comedy, Family, Adventure",Twentieth Century Fox Film Corporation,United States of America,English
17000000,"[{'id': 878, 'name': 'Science Fiction'}, {'id': 28, 'name': 'Action'}, {'id': 12, 'name': 'Adventure'}]",97,en,"As Kevin Flynn searches for proof that he invented a hit video game, he is ""digitalized"" by a laser and finds himself inside The Grid, where programs suffer under the tyrannical rule of the Master Control Program. With the help of TRON, a security program, Flynn seeks to free The Grid from the MCP.",16.574021,"[{'name': 'Walt Disney Pictures', 'id': 2}, {'name': 'Lisberger/Kushner', 'id': 558}]","[{'iso_3166_1': 'US', 'name': 'United States of America'}]",1982-07-09,33000000.0,96.0,"[{'iso_639_1': 'en', 'name': 'English'}]",Released,A world inside the computer where man has never been.  Until now.,Tron,6.6,717.0,1982,1.9411764705882353,63043.0,TRON Collection,"Science Fiction, Action, Adventure",Walt Disney Pictures,United States of America,English
68000000,"[{'id': 53, 'name': 'Thriller'}, {'id': 28, 'name': 'Action'}, {'id': 10749, 'name': 'Romance'}, {'id': 878, 'name': 'Science Fiction'}, {'id': 12, 'name': 'Adventure'}]",10003,en,"Ivan Tretiak, Russian Mafia boss who wants to create an oil crisis in Moscow and seize power as a result sends Simon Templar, great international criminal, to England to get a secret formula for cold fusion from U.S. scientist Emma Russell. Templar falls in love with Emma and they try to outwit Tretiak and his guerrillas, hiding from them in Moscow",10.97633,"[{'name': 'Paramount Pictures', 'id': 4}, {'name': 'Mace Neufeld Productions', 'id': 2767}, {'name': 'Rysher Entertainment', 'id': 11661}]","[{'iso_3166_1': 'US', 'name': 'United States of America'}]",1997-04-03,118063304.0,116.0,"[{'iso_639_1': 'en', 'name': 'English'}, {'iso_639_1': 'ru', 'name': 'Pусский'}]",Released,Never reveal your name. Never turn your back. Never surrender your heart.,The Saint,5.9,310.0,1997,1.7362250588235295,86224.0,The Saint Collection,"Thriller, Action, Romance, Science Fiction, Adventure",Paramount Pictures,United States of America,English
